id,industry,sub_industry,data_type,is_breakout,keywords,search_volume,city_name,cluster_number,added_at,data_source
764,healthcare,telehealth,topic,FALSE,"License, Technology, Nurse, Mercy, Pharmaceutical drug, Anthem, Company, Rural area, Certification, Medicaid, Job, Cigna, UnitedHealth Group Inc, Screening, Data, Telemedicine, Tricare, Online doctor, Telemedicine, Hospital, Telemedicine, Artificial intelligence, Medicine, Remote work, Artificial intelligence, Artificial intelligence, Medicare, UnitedHealthcare Inc, ICD-10, Job, Career, Pharmacy, Urinary tract infection, Ultrasonography, Technology, Technology, Radiographer, Clinic, Job, Higher Education School, Technician, Hospital, System, Salary, Career, Sonographer, Salary, Radiographer, Higher Education School, Physician, Pharmacy Technician, Science, Intelligence, Donald Trump, Data, Physician, Technician, Science, Patient, Psychiatric technician, Patient, Career, Unlicensed assistive personnel, Medicare, Job, Urgent care center, Nurse, Medical prescription, Insurance, Teladoc",5484,St Louis,1,26:38.0,Google Trends
765,healthcare,urgent care,topic,FALSE,"Mary Bridge Children's Urgent Care - Gig Harbor, Overlake Clinics Lake Hills Urgent Care, MultiCare Health System, Inc., Rapid Orthopedic Urgent Care - West Olympia, MultiCare Indigo Urgent Care - Seattle - Rainier Ave., Urgent care center, EvergreenHealth Urgent Care, Monroe, Carbon Health Urgent Care Lynnwood - Lynnwood Place, MultiCare Indigo Urgent Care - Shoreline, MultiCare West Tacoma Urgent Care, MultiCare Indigo Urgent Care - Marysville, Swedish Urgent Care - Factoria, UW Medicine Urgent Care at Issaquah, EvergreenHealth Urgent Care, Canyon Park, MultiCare Indigo Urgent Care - Kent, Tran Urgent Care & Wellness Centers, MultiCare Indigo Urgent Care - Seattle - Rainier Ave., Capital Pet Urgent Care, Overlake Clinics Issaquah Urgent Care, MultiCare Indigo Urgent Care - Kirkland, MultiCare, MultiCare Indigo Urgent Care - Kirkland, MultiCare, ZOOM+Care, Urgent Care | Kaiser Permanente Olympia Medical Center, Concentra Urgent Care, Swedish Urgent Care - Factoria, MultiCare Indigo Urgent Care - Gig Harbor - Borgen Blvd., EvergreenHealth Urgent Care, Canyon Park, ZOOM+Care, MultiCare Indigo Urgent Care - Marysville, MultiCare Indigo Urgent Care - Sammamish, MultiCare Indigo Urgent Care - Poulsbo, Overlake Clinics Redmond Urgent Care, MultiCare Health System, Inc., MultiCare Health System, Inc., Renton Landing Clinic - Urgent Care - Valley Medical Center, Gig Harbor, UW Medicine Urgent Care at Ravenna, Gig Harbor, Gig Harbor, Mary Bridge Children's Urgent Care - Gig Harbor, UW Medicine Urgent Care at Ravenna, MultiCare Indigo Urgent Care - Puyallup - Meridian & 152nd, Renton Landing Clinic - Urgent Care - Valley Medical Center, Swedish Urgent Care - Edmonds, Family Care Network - Urgent Care - Bellingham, Overlake Clinics Redmond Urgent Care, Mary Bridge Children's Urgent Care - Gig Harbor, Renton Landing Clinic - Urgent Care - Valley Medical Center, MultiCare Indigo Urgent Care - Puyallup - Meridian & 152nd, UW Medicine Urgent Care at Ballard",2785,Seattle,0,26:38.0,Google Trends
808,healthcare,telehealth,query,TRUE,telehealth that accepts medicaid,,St Louis,0,26:38.0,Google Trends
809,healthcare,telehealth,query,TRUE,is telehealth ending,,St Louis,2,26:38.0,Google Trends
766,healthcare,urgent care,topic,FALSE,"ZoomCare, Providence Medical Group, Vaccine, Blood test, - The Everett Clinic, Pain management, Providence Medical Group, Everett, Port Orchard, Ear pain, Chest pain, Mantoux test, Wenatchee, Edmonds, Everett, Northgate, Veterinarian, Throat, Renton, MinuteClinic, Clinic, MinuteClinic, CT scan, MinuteClinic, Sea Mar, Soccer, MinuteClinic at CVS, Factoria, Walk-in clinic, Walk-in clinic, 10 Minute Walk-In Clinic, Pain, Allegro Pediatrics-, Infection, Allegro Pediatrics-, Totem Lake, University Place, Abortion, Regence BlueCross BlueShield of Oregon, Change Healthcare, Carbon Health, Sore throat, GE Healthcare, Factoria, The Polyclinic, Otitis media, Aetna, CVS Pharmacy, CVS, CVS Pharmacy, Community, Newcastle, Emergency department, The Doctors Clinic, Virginia Mason Medical Center, CVS Pharmacy, Veterinarian, Veterinarian, The Everett Clinic, - The Everett Clinic, Molina Healthcare, Molina Healthcare Inc, CVS Health Corporation, Neutering, Mantoux test, Edmonds, Neutering, MinuteClinic at CVS, - The Everett Clinic, Seattle Children's Urgent Care in Seattle, Seattle Children's, Seattle Children's Urgent Care in Seattle, Kaiser Permanente, Seattle Children's, Seattle Children's Urgent Care in Seattle, CVS Health Corporation, Walgreens, Walgreens, Jefferson Healthcare, Emergency department, Walgreens, Neutering, CVS Health Corporation, Tuberculosis, Seattle Children's Hospital, Concentra, Optum - Smokey Point Walk-In Clinic, Throat, Covington, Pharmacy, Streptococcal pharyngitis, Pneumonia, Urinary tract infection, Streptococcal pharyngitis, X-ray, X-ray",6329,Seattle,1,26:38.0,Google Trends
767,healthcare,urgent care,topic,FALSE,"Mercy-GoHealth Urgent Care, SSM Health Urgent Care, SSM Health Behavioral Health Urgent Care, Total Access Urgent Care - Chesterfield, Mercy Urgent Care, Mercy, Total Access Urgent Care - Tower Grove, St. Luke's Urgent Care - Creve Coeur, 24/7 Urgent Care (Downtown St. Louis), Total Access Urgent Care - St. Peters, Mercy Urgent Care, Total Access Urgent Care - Creve Coeur, Total Access Urgent Care - Affton, SSM Health Urgent Care, Mercy-GoHealth Urgent Care, North City Urgent Care, Urgent care center, Total Access Urgent Care - Washington, SSM Health Behavioral Health Urgent Care, Total Access Urgent Care - Hampton, Mercy-GoHealth Urgent Care, Doctors Urgent Care Alton - Alton Urgent Care & Telemedicine, St. Luke's Urgent Care - Fenton, Zip Clinic Urgent Care | Maryland Heights, Urgent care center, Total Access Urgent Care - Valley Park, Total Access Urgent Care - St. Louis Hills, Concentra Urgent Care, SSM Health Cardinal Glennon Pediatric Urgent Care, SSM Health Urgent Care, Total Access Urgent Care, Total Access Urgent Care, Total Access Urgent Care, Total Access Urgent Care, Mercy, SSM Health Cardinal Glennon Pediatric Urgent Care, Mercy, Total Access Urgent Care - Wentzville",4425,St Louis,0,26:38.0,Google Trends
768,healthcare,urgent care,topic,FALSE,"Streptococcal pharyngitis, TriWest Healthcare Alliance, Planned Parenthood, SSM Health Medical Group, Gravois Road, Streptococcal pharyngitis, Dentistry, De Paul Drive, Kisker Road, Streptococcus, Free clinic, Swansea, Dr. Sonny Saggar, Chest pain, BJC Medical Group, STD testing, Anderson Hospital ExpressCare Bethalto, Walk-in clinic, Sinusitis, Emergency department, Southern Il Health Care Foundation, Streptococcal pharyngitis, Mantoux test, Free clinic, SIHF Healthcare - Alton, Winghaven Boulevard, OSF HealthCare - Medical Group - PromptCare, Washington University Childrens After Hours - South County, Hospital, Steroid, MinuteClinic, MinuteClinic, Walk-in clinic, STD testing, Fever, Recruitment, Elevance Health, Chest pain, Anderson Hospital ExpressCare Collinsville, Otorhinolaryngology, Heartland Women's Healthcare, HCA, Concentra, Emergency department, CVS Pharmacy, CVS, CVS, CVS Pharmacy, CVS, CVS Pharmacy, Cat, Pet, Orthopedics, Veterinarian, Veterinarian, Walgreens, Walgreens, CVS Health Corporation, SSM Health Medical Group, Affinia Healthcare, BJC Health, BJC HealthCare, Sexually transmitted infection, Essence Healthcare, Tuberculosis, Pediatrics, Throat, X-ray, MinuteClinic at CVS, Emergency department, X-ray, Pneumonia",7280,St Louis,1,26:38.0,Google Trends
769,technology,artificial intelligence,topic,FALSE,"Gaza, Regulatory compliance, Small Industry, Computer Science, Ai Weiwei, Course, Analysis, Computer programming, Business model, Plan, Sesame AI, Inc., SAM, Certification, Property, NVIDIA, Seattle Art Museum, cut, Ethics, Adobe, Language, Academic journal, LinkedIn, 2024, Large language model, Large language model, Deep learning, Deep learning, Grok, Large language model, Machine learning, Infrastructure, Business, Regulation, Learning, Regulation, Deep learning, connect, Health care, Adobe, Prediction, Learning, AI LIMIT, Limited Liability Company, Microsoft Copilot, Ryzen, Magic school, Cursor, Intelligent agent, Science, Computer Science, Scale AI, Hayao Miyazaki, Language model, Experience, Master's Degree, Future, Business model, Machine learning, Machine, United States, Regulatory compliance, Neural network, Image, NVIDIA, Law, Email, Small Industry, Cost, Name, Nvidia, Science, Course, Student, Design, Adobe Photoshop, Gemini, Text-to-image model, Character.ai, Education, Human, Engineering, Adobe Photoshop, Education, Robot, Course, User Experience, Character.ai, Adobe Photoshop, Character.ai, Gemini, Google AI, Claude, Google AI, Text-to-image model, Claude, OpenAI, Text-to-image model, Algorithm, Google AI, OpenAI, Claude, Gemini, Humanise.AI, Microsoft Bing, Meta AI, Grok, Microsoft Copilot, Humanise.AI, Grammarly, Plagiarism, Scale AI, Deep AI Inc, Speech synthesis, Manus, Seattle Art Museum, xAI, Anthropic",10844,Seattle,0,26:38.0,Google Trends
770,technology,artificial intelligence,topic,FALSE,"MIT Computer Science & Artificial Intelligence Laboratory, Generative artificial intelligence, Artificial general intelligence, Intelligence, Generative artificial intelligence, Generative artificial intelligence, Intelligence, A.I. Artificial Intelligence, Artificial intelligence content detection, Artificial intelligence content detection, Artificial general intelligence, Artificial intelligence content detection, A.I. Artificial Intelligence, Artificial intelligence art, A.I. Artificial Intelligence, Artificial general intelligence",897,Seattle,1,26:38.0,Google Trends
771,technology,artificial intelligence,topic,FALSE,"Sesame AI, Inc., Sushi Ai, AI LIMIT, Scale AI, Question.AI - Chatbot&Math AI, Sushi Ai, Sushi Ai, Education, Image, BigBear.ai, SPANK - Spicy AI Chats, SPANK - Spicy AI Chats, Education, Large language model, Character.ai, Character.ai, Character.ai, Text-to-image model, Language model, Text-to-image model, Text-to-image model, Education, Humanise.AI, Google AI, Humanise.AI, Google AI, Google AI, Humanise.AI, Sushi, Sushi",1749,St Louis,0,26:38.0,Google Trends
810,healthcare,urgent care,query,TRUE,blood clinics near me,,Seattle,0,26:38.0,Google Trends
811,healthcare,urgent care,query,TRUE,24/7 urgent care near me,,Seattle,1,26:38.0,Google Trends
812,healthcare,urgent care,query,TRUE,"strep throat symptoms, comprehensive healthcare yakima, evicore healthcare",,Seattle,2,26:38.0,Google Trends
813,healthcare,urgent care,query,TRUE,"dentist near me, total access urgent care tesson ferry, sonny saggar, walgreens pharmacy, planned parenthood, pet urgent care of st peters, sinus infection symptoms, urgent care vs emergency room, kidney infection symptoms, google ads, favorite healthcare staffing, mercy hospital st louis",,St Louis,0,26:38.0,Google Trends
814,healthcare,urgent care,query,TRUE,"urgent care near me, northside urgent care, mercy urgent care eureka mo, nearest urgent care to me, wellnow urgent care o'fallon il, fast track urgent care florissant mo, fast track urgent care florissant mo",,St Louis,1,26:38.0,Google Trends
772,technology,artificial intelligence,topic,FALSE,"DeepSeek, Social media, Training, Patient, Higher Education School, Analytics, Grok, Regulation, Artificial general intelligence, Software, Revolution, Deep learning, Behavior, Python, Science, Generative artificial intelligence, Regulation, Implementation, Generative artificial intelligence, Job, Gauth, Regulation, Generative artificial intelligence, Intelligence, Online chat, Microsoft Copilot, Student, A.I. Artificial Intelligence, Energy, University, Citation, Bias, Apple Intelligence, Studio Ghibli, Thought, Homework, Paraphrase, Gauth, Rsum, United States, ChatGPT, Science, Artificial intelligence content detection, Artificial intelligence content detection, Online chat, Learning, Course, Health care, United States, Human, Artificial intelligence art, Online chat, Capitalization, Artificial intelligence art, Machine learning, Income, Machine learning, Gemini, Bias, Critical thinking, Gemini, Gemini, Artificial intelligence art, A.I. Artificial Intelligence, Machine, Grok, Claude, OpenAI, Adobe Photoshop, PolyBuzz, Grok, Claude, Not safe for work, QuillBot, Cursor, Presentation",6603,St Louis,1,26:38.0,Google Trends
773,technology,cloud computing,topic,FALSE,"Software as a service, Google Cloud Platform, Server, User, Question, Security Camera, Amazon Web Services, Western Governors University, Security controls, Private cloud computing infrastructure, Product, Computing, Computing, Serverless computing, Cloud computing security, Cloud computing security, Parallel computing, On-premises software, Google Cloud Platform, Cloud Security Alliance, Information, Google Cloud Platform, Risk | Brilliant Math & Science Wiki, Microsoft Azure, Microsoft Azure",3723,Seattle,0,26:38.0,Google Trends
774,technology,cloud computing,topic,FALSE,"Hybrid cloud storage, Computer, Hybrid vehicle, Edge computing, Distributed computing, Cloud storage, Edge computing, Distributed computing, Distributed computing, Edge computing, Computer data storage, Hybrid vehicle, Hybrid cloud storage, Hybrid cloud storage",1577,Seattle,1,26:38.0,Google Trends
775,technology,cloud computing,topic,FALSE,"Automation, Industry, Computer network, Efficiency, Organization, Customer, Google Cloud Platform, World Wide Web, Technology, Amazon Web Services, Google Cloud Platform, Mattress, Internet, Password, Virtualization, Computer, Cost, Management, Computer network, Hybrid cloud storage, Data, Amazon Web Services, Operating system, Cloud storage, Server, User, Microsoft Azure, Research, Virtualization",3066,St Louis,0,26:38.0,Google Trends
776,technology,cloud computing,topic,FALSE,"Computing platform, Cloud computing, Computing, Edge computing, Distributed computing, Cloud computing, Distributed computing, Computing, Edge computing, Edge computing, Cloud computing security, Cloud computing security, Cloud computing security, Security, Private cloud computing infrastructure",1146,St Louis,1,26:38.0,Google Trends
777,technology,e-commerce,topic,FALSE,"Temu, China, Furniture, SHEIN, Consumer, Freight transport, Customer, Social Security, Safeway, Macy's, System, Social commerce, Social, Security, Brand, United States, Macy's, Inc., Pricing, E-commerce, Commerce, Shopping, Commerce, Shopping, T.J. Maxx, E-commerce, Shopping, Social, Commerce, Online shopping, Online shopping, Online shopping, Retail, Retail, Economy, Walmart, Society, Strategy, Retail, China, Pricing strategies, Pricing strategies, Grocery store, Charity shop, Social media, Social Security, Culture, Clothing, Social commerce, Wealth, Social Security Administration, Amazon.com, Amazon Hub Counter, Clothing, Furniture, Sales, Book, Market, Design, Brand, Walmart, Trade, Trade, Design, Computing platform, Trade, Marketing, Clothing, India, India, Grocery store, Safeway, Grocery store, Macy's, Inc.",6450,Seattle,0,26:38.0,Google Trends
778,technology,e-commerce,topic,FALSE,"Target Corporation, Fred Meyer, Costco Wholesale, Costco Wholesale, Costco Wholesale, Delivery, Target Corporation, Target, Target Corporation, Target, Delivery, Target, Delivery, Fred Meyer, Fred Meyer",168,Seattle,1,26:38.0,Google Trends
779,technology,e-commerce,topic,FALSE,"Commerce Bancshares, Commerce Bancshares, Commerce Bank, E-commerce, E-commerce, E-commerce, Commerce, E-commerce, Commerce, Commerce, Commerce",1414,St Louis,0,26:38.0,Google Trends
780,technology,e-commerce,topic,FALSE,"Profit, Social, Technology, Risk | Brilliant Math & Science Wiki, Amazon.com, Competition, Menards, United States, QVC, Internet, Fingerhut, Ross Stores, Ross Stores, Sam's Club, cheap, Grocery store, good, Product, Kohl's, Delivery, Pricing, good, Pricing, Shopping, Retail, Shopping, Macy's, Inc., HomeGoods, JCPenney, ALDI, Online shopping, Pricing strategies, Ross Dress for Less, Online shopping, Grocery store, Dress, Social Security, Small Industry, Marketing, JCPenney, Temu, Trade, Target, Marketing, Marketing, Social Security Administration, Social Security Administration, Social Security, Social Security Administration, Pricing strategies, Price, Vacation, Production, Social, Social Security, Sales, Walmart, Walmart, Consumer, create, Trade, Target Corporation, Schnucks, Target Corporation, ALDI, Personalization, Costco Wholesale, Target, QVC, Grocery store, Costco Wholesale, Schnucks, Aldi, JCPenney, ALDI, Kohl's",6971,St Louis,1,26:38.0,Google Trends
781,technology,enterprise software,topic,FALSE,"Software, Software, Software as a service, Enterprise resource planning, Enterprise resource planning, Enterprise software, Enterprise software, Enterprise software, Enterprise, Software engineer, Software development, Software development",657,Seattle,0,26:38.0,Google Trends
782,technology,enterprise software,topic,FALSE,"Data, Sales tax, used, Athletics, Tuition payments, Market, System, Vulnerability, Employee, Uber Technologies Inc, Temple Building - Upper School Humanities, important, Fee, Customer relationship management, Workflow, Customer relationship management, Workflow, Automation, Customer relationship management, Workflow, Cost, Seattle Academy, Service, Server, Sales, Website, Computer data storage, Seattle Academy, Engineer, Job, Seattle Academy, Microsoft Windows, Business intelligence, calendar, calendar, Temple Building - Upper School Humanities, Temple Building - Upper School Humanities, Platform as a service, Business-to-business, Athletics",3930,Seattle,1,26:38.0,Google Trends
783,technology,enterprise software,topic,FALSE,"Enterprise software, Software, Software as a service, Software as a service, Enterprise resource planning, Software as a service, Enterprise resource planning, Enterprise software, Enterprise software, Enterprise software, Enterprise, Application software, Enterprise, Enterprise",1021,St Louis,0,26:38.0,Google Trends
784,technology,enterprise software,topic,FALSE,"Information, Finance, Computer security, Business-to-business, Security, Organization, Platform as a service, Planning, Computer security, Workflow, Customer relationship management, Meaning, Business, Business-to-business, Computing platform, used, Workflow, Company, Resource, Operating system, used, Desktop computer, Planning, World Wide Technology, Computer, SAP, Production, Business-to-business, Contract, Meaning, Career",2790,St Louis,1,26:38.0,Google Trends
815,technology,artificial intelligence,query,TRUE,"a.i. artificial intelligence, jeff dunham artificial intelligence, aviation week and space technology",,Seattle,0,26:38.0,Google Trends
816,technology,artificial intelligence,query,TRUE,"manus ai, manus",,Seattle,1,26:38.0,Google Trends
817,technology,artificial intelligence,query,TRUE,"trump ai gaza, agentic ai vs generative ai, trump gaza ai video",,Seattle,2,26:38.0,Google Trends
785,technology,fintech,topic,FALSE,"Fee, Password, Amazon Web Services, Savings, Walmart, PayPal, Chime, Savings, Mercury Technologies, Near-field communication, New York, Account, Transaction account, Cheque, Citibank, Overdraft, Cryptocurrency, Columbia Banking System, Bank, Buy now, pay later, Wells Fargo, Bank, Management, Fintech, Fintech, Machine, Buy now, pay later, Buy now, pay later, Ramp, Online banking, Online banking, Online banking, Bank account, Affirm, Wells Fargo Bank, Home, check, Password, Technology, Deposit, Bank Of Montreal, Project, Meetup, KeyBank, Meetup, Godrej Properties, Digital, PayPal, Bank account, Startup company, Near-field communication, Apple, Cheque, Bank of America, PayPal, Bank of America, Ticket, Account, Bank of America, KeyBank Mobile Banking, Loan, Flight, Loan, Chase Bank, Klarna, PNC Financial Services, Chase Bank, KeyBank, Chase Bank, DoorDash, JPMorgan Chase & Co, Stripe, Inc., JPMorgan Chase & Co, Affirm, JPMorgan Chase & Co, Career, Deposit, Wells Fargo, Stripe, Inc., Wells Fargo Bank, Wells Fargo, Interest, Interest rate, Royal Bank of Canada, ABA routing transit number, U.S. Bancorp, U.S. Bancorp, ABA routing transit number, U.S. Bank Branch, RBC Royal Bank, Convention, Royal Bank of Canada, Wells Fargo Bank, Yahoo Mail, Columbia Banking System",6342,Seattle,0,26:38.0,Google Trends
786,technology,fintech,topic,FALSE,"Mobile payment, WSECU Mobile Banking, Credit, Whatcom Educational Credit Union, Payment, Mobile banking, Contactless payment, Becu, Mobile banking, ATM Twinstar Credit Union, Mobile banking, Mobile phone, Mobile phone, Mobile app, BECU, Mobile phone, Becu, Becu, BECU, BECU, Mobile payment, Mobile app, Credit, WSECU, Bank of America Financial Center, Washington State Employees Credit Union, Bank of America Financial Center, Bank of America Financial Center, Washington State Employees Credit Union, Credit checks, Credit checks, WSECU, Down payment, Credit union, WSECU, Credit union, Credit card, Credit union, Washington State Employees Credit Union",2030,Seattle,1,26:38.0,Google Trends
787,technology,fintech,topic,FALSE,"Bill paying, Deposit, Mobile banking, St. Louis Community Credit Union, Capital One, Transaction account, Credit, Account, Cheque, Affirm, Industry, Klarna, PNC Financial Services, Credit, Management, Payment, Small Industry, Discover Financial Services, Credit checks, Buy now, pay later, Fintech, Payment, Buy now, pay later, PNC Financial Services, Fintech, Payment, Buy now, pay later, Fintech, Online banking, Online banking, Online banking, Mobile banking, Mobile banking, Salary, Mobile phone, Mobile payment, 1st MidAmerica Credit Union, JPMorgan Chase & Co, Commerce Bancshares, Afterpay, PNC Financial Services, JPMorgan Chase & Co, Cheque, ATM, Regions Financial Corp, Regions Financial Corp, Regions Financial Corp, Mobile app, Transaction account, Credit, PNC Mobile, PNC Mobile, Interest, Credit checks, Account, Credit checks, Money, Rate, Cheque, Transaction account, Deposit account, Money, Savings, Interest, Savings account, Interest rate, check, ATM, Credit union, Deposit, U.S. Bancorp, Credit union, Account, 1st MidAmerica Credit Union, Klarna, U.S. Bancorp, JPMorgan Chase & Co, Credit union, U.S. Bancorp, St. Louis Community Credit Union",6242,St Louis,0,26:38.0,Google Trends
788,technology,fintech,topic,FALSE,"Bank account, Associated Bank, Bank statement, Wells Fargo Bank, Capital One Bank, Bank account, Bank, Bank, Bank, First Citizens Bank, First Citizens Bank, Bank Of Montreal, Regions Bank, Regions Bank, Regions Bank, PNC Bank, PNC Bank, PNC Bank, Bank of America, Bank of America Financial Center, Bank of America, Bank of America, Bank of America Financial Center, Bank of America Financial Center, U.S. Bank Branch, Commerce Bank, Chase Bank, Commerce Bank, Chase Bank, U.S. Bank Branch, Chase Bank, First Citizens Bank, UMB Bank, U.S. Bank Branch",2117,St Louis,1,26:38.0,Google Trends
789,healthcare,dental care,query,TRUE,"southside dental care, united health care dental provider portal, soft care dental, sterling dental care, puyallup valley dental care",,Seattle,0,26:38.0,Google Trends
790,healthcare,dental care,query,TRUE,"moses lake pediatric dentistry, oral surgery associates olympia, mobius knee braces, george with braces peppa pig, how much are braces with insurance, adult braces before and after, spokane pediatric dentistry, electric toothbrush for braces, teal braces, floss threaders for braces, white spots on teeth after braces, is invisalign cheaper than braces, incognito braces, best invisible braces, how much do braces cost with insurance",,Seattle,1,26:38.0,Google Trends
791,healthcare,dental care,query,TRUE,"bloom pediatric dentistry, oral surgery assistant jobs near me, united health care dental providers, dental implants specialist, dental care for kids marion il, billy shoes for braces, floss for braces, ceramic braces cost",,St Louis,0,26:38.0,Google Trends
792,healthcare,dental care,query,TRUE,"family dental care near me, southside dental care, southside dental care, jungermann dental care, prestige dental care, springfield dental care, all smiles dental care, jungermann dental care",,St Louis,1,26:38.0,Google Trends
793,healthcare,health insurance,query,TRUE,"medicare login, aetna medicare advantage login, unitedhealthcare medicare advantage login, aarp unitedhealthcare medicare advantage login, rick scott medicare, original medicare vs medicare advantage, medicare section nyt crossword, premera medicare supplement, medicare virtual visits, medicare age eligibility, planned parenthood, 1800 medicare, does medicare cover in home care, medicare vote 2025, who qualifies for medicare, does medicare cover hearing aids, humana medicare advantage plans 2025",,Seattle,0,26:38.0,Google Trends
794,healthcare,health insurance,query,TRUE,"dental office near me, medicare telehealth april 1, medicare ending telehealth, medicaid telehealth, when is open enrollment for health insurance 2025, is it illegal to not have health insurance, emmy statuette, molina health insurance phone number, the federal income taxes that are withheld from your paycheck are used to pay for what?, how many people are on medicaid, part time jobs with health insurance, united healthcare provider portal",,Seattle,1,26:38.0,Google Trends
795,healthcare,health insurance,query,TRUE,"anthem medicare advantage plans, anthem medicare advantage plans, medicare telehealth 2025, rick scott medicare fraud, medicare.gov, medicare telehealth april 1, does medicare cover hearing aids, rick scott medicare fraud case",,St Louis,0,26:38.0,Google Trends
